{
  "schema_version": "demoops.execution_request.v1",
  "request_id": "request-execution-001",
  "idempotency_key": "workflow-001:execution-capture:attempt-1",
  "workflow_id": "workflow-001",
  "workflow_template_id": "interactive-application-v1",
  "module_id": "execution-capture",
  "module_version": "1.0.0",
  "attempt": 1,
  "capability": "browser.execute",
  "replay_policy": "once_effect",
  "input_artifact_refs": [
    { "artifact_id": "approved-bundle-001", "revision": 1, "role": "approved_execution_bundle" }
  ],
  "config_ref": "config://module/execution-capture/default",
  "policy_ref": "policy://execution/internal-v1",
  "authorization_refs": [
    { "ref": "authorization://user/approval-001", "kind": "user_approval", "expires_at": "2026-08-21T12:00:00Z" }
  ],
  "budget": {
    "max_runtime_ms": 900000,
    "max_attempts": 1,
    "max_provider_calls": 0,
    "max_cost_minor_units": 0,
    "max_event_bytes": 524288
  },
  "deadline_at": "2026-08-21T12:30:00Z",
  "trace_context": {
    "trace_id": "trace-workflow-001",
    "correlation_id": "correlation-workflow-001"
  }
}
